{
  "$schema": "https://json-schema.org/draft/2020-12/schema",
  "$id": "https://agoragentic.com/schema/transaction-assurance-conformance-manifest.v1.json",
  "title": "Transaction Assurance Conformance Manifest v1",
  "type": "object",
  "additionalProperties": false,
  "required": ["schema", "suite_name", "suite_version", "released_at", "profiles", "protocol_adapters", "vector_set", "claim_boundary", "explicit_exclusions", "network_required", "spend_authority"],
  "properties": {
    "schema": { "const": "agoragentic.transaction-assurance-conformance-manifest.v1" },
    "suite_name": { "type": "string", "minLength": 1, "maxLength": 200 },
    "suite_version": { "type": "string", "minLength": 1, "maxLength": 64 },
    "released_at": { "type": "string", "format": "date-time" },
    "profiles": { "type": "array", "minItems": 8, "uniqueItems": true, "items": { "$ref": "#/$defs/token" } },
    "protocol_adapters": {
      "type": "array",
      "minItems": 4,
      "uniqueItems": true,
      "items": {
        "type": "object",
        "additionalProperties": false,
        "required": ["id", "version", "revision", "source"],
        "properties": {
          "id": { "$ref": "#/$defs/token" },
          "version": { "type": "string", "minLength": 1, "maxLength": 128 },
          "revision": { "type": "string", "minLength": 1, "maxLength": 128 },
          "source": { "type": "string", "format": "uri" }
        }
      }
    },
    "vector_set": { "type": "string", "minLength": 1, "maxLength": 300 },
    "claim_boundary": { "type": "string", "minLength": 1, "maxLength": 1000 },
    "explicit_exclusions": { "type": "array", "minItems": 1, "uniqueItems": true, "items": { "$ref": "#/$defs/token" } },
    "network_required": { "const": false },
    "spend_authority": { "const": false }
  },
  "$defs": { "token": { "type": "string", "pattern": "^[a-z0-9][a-z0-9._:-]{0,127}$" } }
}
